{
  "schema_version": "drawai-strokes-v1",
  "canvas": {
    "width": 94,
    "height": 268
  },
  "coordinate_system": "canvas-y-down",
  "strokes": [
    [
      {
        "x": 5,
        "y": 125
      },
      {
        "x": 2,
        "y": 131
      },
      {
        "x": 0,
        "y": 135
      },
      {
        "x": 0,
        "y": 137
      },
      {
        "x": 2,
        "y": 134
      },
      {
        "x": 9,
        "y": 126
      },
      {
        "x": 21,
        "y": 115
      },
      {
        "x": 31,
        "y": 99
      },
      {
        "x": 43,
        "y": 80
      },
      {
        "x": 56,
        "y": 61
      },
      {
        "x": 67,
        "y": 42
      },
      {
        "x": 78,
        "y": 25
      },
      {
        "x": 86,
        "y": 11
      },
      {
        "x": 91,
        "y": 2
      },
      {
        "x": 94,
        "y": 0
      },
      {
        "x": 94,
        "y": 6
      },
      {
        "x": 90,
        "y": 20
      },
      {
        "x": 83,
        "y": 40
      },
      {
        "x": 75,
        "y": 65
      },
      {
        "x": 65,
        "y": 94
      },
      {
        "x": 53,
        "y": 126
      },
      {
        "x": 43,
        "y": 158
      },
      {
        "x": 34,
        "y": 188
      },
      {
        "x": 26,
        "y": 216
      },
      {
        "x": 21,
        "y": 238
      },
      {
        "x": 18,
        "y": 256
      },
      {
        "x": 19,
        "y": 268
      }
    ]
  ],
  "reference_label": 1,
  "source": {
    "kind": "dataset",
    "sample_id": "pendigits-orig.tra:00002",
    "split": "train"
  }
}
