{
  "schema_version": "drawai-strokes-v1",
  "coordinate_system": "canvas-y-down",
  "canvas": { "width": 400, "height": 400 },
  "strokes": [
    [ { "x": 120, "y": 80, "t": 0 }, { "x": 120, "y": 220, "t": 120 } ],
    [ { "x": 220, "y": 100, "t": 240 }, { "x": 260, "y": 220, "t": 360 } ]
  ],
  "reference_label": null,
  "source": { "kind": "synthetic", "sample_id": "d0-two-strokes" }
}
