{
  "schema_version": "drawai-strokes-v1",
  "coordinate_system": "canvas-y-down",
  "canvas": {
    "width": 400,
    "height": 400
  },
  "strokes": [
    [
      {
        "x": 119.99998865039588,
        "y": 80.00001134960412
      },
      {
        "x": 129.33333560325414,
        "y": 93.33332765853127
      },
      {
        "x": 138.66665418210212,
        "y": 106.66667234146874
      },
      {
        "x": 148.0000011349604,
        "y": 119.99998865039588
      },
      {
        "x": 157.33331971380838,
        "y": 133.33333333333331
      },
      {
        "x": 166.66666666666669,
        "y": 146.6666780162708
      },
      {
        "x": 176.00001361952496,
        "y": 159.99999432519795
      },
      {
        "x": 185.33333219837291,
        "y": 173.3333390081354
      },
      {
        "x": 194.66667915123122,
        "y": 186.66665531706255
      },
      {
        "x": 203.99999773007917,
        "y": 200
      },
      {
        "x": 213.33334468293748,
        "y": 213.33334468293748
      },
      {
        "x": 222.66666326178543,
        "y": 226.6666609918646
      },
      {
        "x": 232.00001021464368,
        "y": 240.00000567480205
      },
      {
        "x": 241.3333287934917,
        "y": 253.3333219837292
      },
      {
        "x": 250.66667574634997,
        "y": 266.66666666666663
      },
      {
        "x": 260.0000226992083,
        "y": 280.0000113496041
      }
    ]
  ],
  "reference_label": 7,
  "source": {
    "kind": "user"
  }
}